{
  "$id": "https://prisma.dev/schemas/data-contract-sql-v1.json",
  "$schema": "https://json-schema.org/draft/2020-12/schema",
  "title": "Prisma Next Data Contract SQL v1",
  "description": "Schema for Prisma Next contract.json files for SQL target family (postgres, mysql, sqlite, etc.)",
  "type": "object",
  "additionalProperties": false,
  "properties": {
    "$schema": {
      "type": "string",
      "description": "Reference to this JSON schema for IDE validation"
    },
    "schemaVersion": {
      "type": "string",
      "enum": ["1"],
      "description": "Contract schema version"
    },
    "target": {
      "type": "string",
      "description": "Database target identifier (e.g., 'postgres', 'mysql', 'sqlite')"
    },
    "targetFamily": {
      "type": "string",
      "enum": ["sql"],
      "description": "Target family classification"
    },
    "coreHash": {
      "type": "string",
      "pattern": "^sha256:[a-f0-9]{64}$",
      "description": "SHA-256 hash of the core schema structure (models, fields, relations, storage layout)"
    },
    "profileHash": {
      "type": "string",
      "pattern": "^sha256:[a-f0-9]{64}$",
      "description": "SHA-256 hash of the pinned capability profile (capability keys/variants and adapter pins)"
    },
    "capabilities": {
      "type": "object",
      "description": "Capability flags declared by the contract",
      "additionalProperties": {
        "type": "object",
        "additionalProperties": {
          "type": "boolean"
        }
      }
    },
    "extensions": {
      "type": "object",
      "description": "Extension packs and their configuration",
      "additionalProperties": true
    },
    "meta": {
      "type": "object",
      "description": "Non-semantic metadata (excluded from hashing)",
      "additionalProperties": true
    },
    "sources": {
      "type": "object",
      "description": "Read-only sources (views, etc.) available for querying",
      "additionalProperties": {
        "$ref": "#/$defs/Source"
      }
    },
    "storage": {
      "type": "object",
      "description": "Storage layout definition",
      "additionalProperties": false,
      "properties": {
        "tables": {
          "type": "object",
          "description": "Table definitions keyed by table name",
          "additionalProperties": {
            "$ref": "#/$defs/StorageTable"
          }
        }
      },
      "required": ["tables"]
    }
  },
  "required": ["schemaVersion", "target", "targetFamily", "coreHash", "storage"],
  "$defs": {
    "StorageTable": {
      "type": "object",
      "description": "Table definition with columns, constraints, and indexes",
      "additionalProperties": false,
      "properties": {
        "columns": {
          "type": "object",
          "description": "Column definitions keyed by column name",
          "additionalProperties": {
            "$ref": "#/$defs/StorageColumn"
          }
        },
        "primaryKey": {
          "$ref": "#/$defs/PrimaryKey",
          "description": "Primary key constraint definition"
        },
        "uniques": {
          "type": "array",
          "description": "Unique constraint definitions",
          "items": {
            "$ref": "#/$defs/UniqueConstraint"
          }
        },
        "indexes": {
          "type": "array",
          "description": "Index definitions",
          "items": {
            "$ref": "#/$defs/Index"
          }
        },
        "foreignKeys": {
          "type": "array",
          "description": "Foreign key constraint definitions",
          "items": {
            "$ref": "#/$defs/ForeignKey"
          }
        }
      },
      "required": ["columns"]
    },
    "StorageColumn": {
      "type": "object",
      "description": "Column definition with type and nullability",
      "additionalProperties": false,
      "properties": {
        "type": {
          "type": "string",
          "description": "Column type (e.g., 'text', 'int4', 'timestamptz', 'bool')"
        },
        "nullable": {
          "type": "boolean",
          "default": false,
          "description": "Whether the column allows NULL values"
        }
      }
    },
    "PrimaryKey": {
      "type": "object",
      "description": "Primary key constraint",
      "additionalProperties": false,
      "properties": {
        "columns": {
          "type": "array",
          "description": "Column names comprising the primary key",
          "items": {
            "type": "string"
          },
          "minItems": 1
        },
        "name": {
          "type": "string",
          "description": "Constraint name (e.g., 'user_pkey')"
        }
      },
      "required": ["columns"]
    },
    "UniqueConstraint": {
      "type": "object",
      "description": "Unique constraint",
      "additionalProperties": false,
      "properties": {
        "columns": {
          "type": "array",
          "description": "Column names comprising the unique constraint",
          "items": {
            "type": "string"
          },
          "minItems": 1
        },
        "name": {
          "type": "string",
          "description": "Constraint name (e.g., 'user_email_key')"
        }
      },
      "required": ["columns"]
    },
    "Index": {
      "type": "object",
      "description": "Index definition (structure may vary by target)",
      "additionalProperties": false,
      "properties": {
        "columns": {
          "type": "array",
          "description": "Column names indexed",
          "items": {
            "type": "string"
          }
        },
        "name": {
          "type": "string",
          "description": "Index name"
        }
      }
    },
    "ForeignKey": {
      "type": "object",
      "description": "Foreign key constraint definition",
      "additionalProperties": false,
      "properties": {
        "columns": {
          "type": "array",
          "description": "Column names in the referencing table",
          "items": {
            "type": "string"
          }
        },
        "references": {
          "type": "object",
          "description": "Referenced table and columns",
          "additionalProperties": false,
          "properties": {
            "table": {
              "type": "string",
              "description": "Referenced table name"
            },
            "columns": {
              "type": "array",
              "description": "Referenced column names",
              "items": {
                "type": "string"
              }
            }
          },
          "required": ["table", "columns"]
        },
        "name": {
          "type": "string",
          "description": "Foreign key constraint name"
        }
      },
      "required": ["columns", "references"]
    },
    "FieldType": {
      "type": "object",
      "description": "Neutral field type definition for sources and document fields",
      "additionalProperties": false,
      "properties": {
        "type": {
          "type": "string",
          "description": "Field type identifier (e.g., 'int4', 'text', 'bool', 'object', 'array', 'date', 'bytes', 'id')"
        },
        "nullable": {
          "type": "boolean",
          "default": false,
          "description": "Whether the field allows null values"
        },
        "items": {
          "$ref": "#/$defs/FieldType",
          "description": "Item type for array fields"
        },
        "properties": {
          "type": "object",
          "description": "Property definitions for object fields",
          "additionalProperties": {
            "$ref": "#/$defs/FieldType"
          }
        }
      },
      "required": ["type", "nullable"]
    },
    "Source": {
      "type": "object",
      "description": "Read-only source definition for views and other queryable sources",
      "additionalProperties": false,
      "properties": {
        "readOnly": {
          "type": "boolean",
          "description": "Whether mutations (INSERT/UPDATE/DELETE) are disallowed"
        },
        "projection": {
          "type": "object",
          "description": "Field projection mapping column/field name to FieldType",
          "additionalProperties": {
            "$ref": "#/$defs/FieldType"
          }
        },
        "origin": {
          "type": "object",
          "description": "Provenance link to pack-owned block (e.g., view, enum)",
          "additionalProperties": true
        },
        "capabilities": {
          "type": "object",
          "description": "Feature flags relevant to this source",
          "additionalProperties": {
            "type": "boolean"
          }
        }
      },
      "required": ["readOnly", "projection"]
    }
  }
}

