{
  "$schema": "../../schemas/data-contract-sql-v1.json",
  "schemaVersion": "1",
  "target": "postgres",
  "targetFamily": "sql",
  "coreHash": "sha256:test-core",
  "profileHash": "sha256:test-profile",
  "storage": {
    "tables": {
      "user": {
        "columns": {
          "id": { "type": "int4", "nullable": false },
          "email": { "type": "text", "nullable": false },
          "createdAt": { "type": "timestamptz", "nullable": false }
        }
      }
    }
  }
}
